{
  "schemaVersion": 1,
  "project": {
    "name": "infra-python-mongo",
    "rootPath": "/fixtures/scan/infra-python-mongo",
    "gitBranch": null,
    "type": "app"
  },
  "services": [
    {
      "id": ".",
      "name": "infra-python-mongo",
      "kind": "app",
      "rootDirectory": ".",
      "stackId": "fastapi",
      "category": "backend",
      "packageManager": "pip",
      "installCommand": "pip install -r requirements.txt",
      "buildCommand": "pip install -r requirements.txt",
      "startCommand": "uvicorn main:app --host 0.0.0.0 --port 8000",
      "port": 8000,
      "hasDockerfile": false,
      "devCommand": {
        "argv": [
          "uvicorn",
          "main:app",
          "--reload",
          "--port",
          "8000"
        ],
        "workingDirectory": ".",
        "source": "stack-default"
      }
    }
  ],
  "composeFiles": [],
  "composeServices": [],
  "envRequirements": [
    {
      "serviceId": ".",
      "variables": []
    }
  ],
  "infra": [
    {
      "id": "infra:mongodb",
      "kind": "mongodb",
      "usedBy": [
        "."
      ],
      "providedBy": null,
      "evidence": [
        "dependency pymongo in requirements.txt"
      ],
      "host": null,
      "port": null
    }
  ],
  "connections": [
    {
      "from": ".",
      "to": "infra:mongodb",
      "kind": "uses-infra",
      "label": "mongodb"
    }
  ],
  "warnings": []
}
