{
  "schemaVersion": 1,
  "project": {
    "name": "springboot",
    "rootPath": "/fixtures/deploy/springboot",
    "gitBranch": null,
    "type": "app"
  },
  "services": [
    {
      "id": ".",
      "name": "springboot",
      "kind": "app",
      "rootDirectory": ".",
      "stackId": "springboot",
      "category": "backend",
      "packageManager": "maven",
      "installCommand": "mvn dependency:resolve",
      "buildCommand": "mvn clean package -DskipTests",
      "startCommand": "java -jar target/*.jar",
      "port": 8080,
      "hasDockerfile": false,
      "devCommand": {
        "argv": [
          "mvn",
          "spring-boot:run",
          "-Dspring-boot.run.arguments=--server.port=8080"
        ],
        "workingDirectory": ".",
        "source": "stack-default"
      }
    }
  ],
  "composeFiles": [],
  "composeServices": [],
  "envRequirements": [
    {
      "serviceId": ".",
      "variables": []
    }
  ],
  "infra": [],
  "connections": [],
  "warnings": []
}
