{
  "schemaVersion": 1,
  "project": {
    "name": "infra-compose-pg",
    "rootPath": "/fixtures/scan/infra-compose-pg",
    "gitBranch": null,
    "type": "services"
  },
  "services": [
    {
      "id": "compose:api",
      "name": "api",
      "kind": "compose",
      "rootDirectory": "api",
      "stackId": "express",
      "category": "backend",
      "packageManager": "npm",
      "installCommand": "npm i --force",
      "buildCommand": null,
      "startCommand": "npm run start",
      "port": 8080,
      "hasDockerfile": true,
      "devCommand": {
        "argv": [
          "npm",
          "run",
          "start"
        ],
        "workingDirectory": "api",
        "source": "script:start"
      }
    },
    {
      "id": "compose:db",
      "name": "db",
      "kind": "compose",
      "rootDirectory": ".",
      "stackId": null,
      "category": null,
      "packageManager": null,
      "installCommand": null,
      "buildCommand": null,
      "startCommand": null,
      "port": 5432,
      "hasDockerfile": false,
      "devCommand": null
    }
  ],
  "composeFiles": [
    "docker-compose.yml"
  ],
  "composeServices": [
    {
      "name": "api",
      "image": null,
      "buildContext": "api",
      "ports": [
        {
          "host": "8080",
          "container": "8080"
        }
      ],
      "dependsOn": [
        "db"
      ],
      "environment": []
    },
    {
      "name": "db",
      "image": "postgres:16",
      "buildContext": null,
      "ports": [
        {
          "host": "5432",
          "container": "5432"
        }
      ],
      "dependsOn": [],
      "environment": []
    }
  ],
  "envRequirements": [],
  "infra": [
    {
      "kind": "postgres",
      "usedBy": [
        "compose:api"
      ],
      "providedBy": "compose:db",
      "evidence": [
        "image postgres:16 in compose service db",
        "dependency pg in api/package.json"
      ],
      "host": null,
      "port": null
    }
  ],
  "connections": [],
  "warnings": [
    "Service \"db\" has no dev command: it has no local source to run."
  ]
}
