{
  "schemaVersion": 1,
  "project": {
    "name": "docker",
    "rootPath": "/fixtures/scan/docker",
    "gitBranch": null,
    "type": "docker"
  },
  "services": [
    {
      "id": ".",
      "name": "docker",
      "kind": "app",
      "rootDirectory": ".",
      "stackId": "docker",
      "category": "docker",
      "packageManager": null,
      "installCommand": null,
      "buildCommand": null,
      "startCommand": null,
      "port": 80,
      "hasDockerfile": true,
      "devCommand": null
    }
  ],
  "composeFiles": [],
  "composeServices": [],
  "envRequirements": [],
  "infra": [],
  "connections": [],
  "warnings": [
    "Service \"docker\" has no dev command: it builds and runs from its Dockerfile."
  ]
}
