{
  "schemaVersion": 1,
  "project": {
    "name": "django-uv",
    "rootPath": "/fixtures/scan/django-uv",
    "gitBranch": null,
    "type": "app"
  },
  "services": [
    {
      "id": ".",
      "name": "django-uv",
      "kind": "app",
      "rootDirectory": ".",
      "stackId": "django",
      "category": "fullstack",
      "packageManager": "uv",
      "installCommand": "uv sync",
      "buildCommand": "pip install uv && uv sync && python manage.py collectstatic --noinput",
      "startCommand": "gunicorn config.wsgi:application --bind 0.0.0.0:8000",
      "port": 8000,
      "hasDockerfile": false,
      "devCommand": {
        "argv": [
          "uv",
          "run",
          "python",
          "manage.py",
          "runserver",
          "8000"
        ],
        "workingDirectory": ".",
        "source": "stack-default"
      }
    }
  ],
  "composeFiles": [],
  "composeServices": [],
  "envRequirements": [
    {
      "serviceId": ".",
      "variables": []
    }
  ],
  "infra": [
    {
      "kind": "sqlite",
      "usedBy": [
        "."
      ],
      "providedBy": null,
      "evidence": [
        "django engine sqlite3 in mysite/settings.py"
      ],
      "host": null,
      "port": null
    }
  ],
  "connections": [],
  "warnings": []
}
